{
  "$schema": "../../../schemas/tool.schema.json",
  "schema_version": 1,
  "slug": "s7cmd",
  "display_name": "s7cmd",
  "entry_type": "runnable_lister",
  "upstream": { "repository": "https://github.com/nidor1998/s3ls-rs" },
  "language": "Rust",
  "license": "Apache-2.0",
  "tested": {
    "variant": "upstream",
    "repository": "https://github.com/nidor1998/s7cmd",
    "version": {
      "value": "1.5.0",
      "provenance": { "kind": "run", "reference": "../receipts/smoke/_build/help-and-version.txt" }
    },
    "revision": {
      "value": "d589df7ce691edbede05fc9a691ab1787cdb6b9e",
      "provenance": { "kind": "documentation", "reference": "../research/report.md" }
    }
  },
  "study": {
    "groundwork_status": "complete",
    "smoke_execution_status": "ran",
    "verification_status": "passed",
    "auth_status": "anonymous",
    "benchmark_eligibility": "planned"
  },
  "evidence_roots": ["../receipts/smoke"]
}
