{
  "$schema": "../../../schemas/tool.schema.json",
  "schema_version": 1,
  "slug": "swath",
  "display_name": "Swath",
  "entry_type": "runnable_lister",
  "upstream": {
    "repository": "https://github.com/varveio/swath"
  },
  "language": "Java",
  "license": "Apache-2.0",
  "tested": {
    "variant": "upstream",
    "repository": "https://github.com/varveio/swath",
    "version": {
      "value": "0.2.0",
      "provenance": {
        "kind": "documentation",
        "reference": "../research/report.md"
      }
    },
    "revision": {
      "value": "cef8ec24a74ffae14ee6a9462e4b7f6c334fbc32",
      "provenance": {
        "kind": "documentation",
        "reference": "../research/report.md"
      }
    }
  },
  "study": {
    "groundwork_status": "complete",
    "smoke_execution_status": "ran",
    "verification_status": "blocked",
    "auth_status": "anonymous",
    "benchmark_eligibility": "conditional"
  },
  "evidence_roots": [
    "../receipts/observations-v0.2.0"
  ]
}
